title,description,tags,collections,color,brand,featured,badge,thumbnail,image_1,image_2,image_3,image_4,image_5,image_6,image_7,image_8,size_1,sku_1,price_1,discount_1,weight_1,quantity_1,size_2,sku_2,price_2,discount_2,weight_2,quantity_2,size_3,sku_3,price_3,discount_3,weight_3,quantity_3,size_4,sku_4,price_4,discount_4,weight_4,quantity_4,hijabenka,berrybenka,draft,body
Natasha Lace Shirt Brown,Atasan dengan model menarik yang cocok kamu padankan dengan celana slim fit dan mules.,[clothing],"[pakaian, atasan]",brown,hijabenka,,,uploads/natasha-lace-shirt-brown_brown_1.jpg,uploads/natasha-lace-shirt-brown_brown_1.jpg,uploads/natasha-lace-shirt-brown_brown_2.jpg,uploads/natasha-lace-shirt-brown_brown_3.jpg,uploads/natasha-lace-shirt-brown_brown_4.jpg,uploads/natasha-lace-shirt-brown_brown_5.jpg,,,,S,HINACLBRS0-KX,149000,0,700,10,M,HINACLBRM0-ND,149000,0,700,10,L,HINACLBRL0-XX,149000,0,700,10,XL,HINACLBRXL-CG,149000,0,700,10,https://invol.co/cl5iaao,,,Atasan dengan model menarik yang cocok kamu padankan dengan celana slim fit dan mules.
Erika Tunic Blue Printing,Miliki atasan dengan model menarik yang dapat kamu padankan dengan celana dan hijab favoritmu.,"[clothing, baju kerja wanita]","[pakaian, atasan]",blue,hijabenka,,,uploads/erika-tunic-blue-printing_blue_1.jpg,uploads/erika-tunic-blue-printing_blue_1.jpg,uploads/erika-tunic-blue-printing_blue_2.jpg,uploads/erika-tunic-blue-printing_blue_3.jpg,,,,,,S,HIERCLBLS0-GS,199000,0,700,10,M,HIERCLBLM0-T0,199000,0,700,10,L,HIERCLBLL0-GK,199000,0,700,10,XL,HINACLBRXL-CG,199000,0,700,10,https://invol.co/cl5iapa,,,Miliki atasan dengan model menarik yang dapat kamu padankan dengan celana dan hijab favoritmu.
Roselma Glitter Top Pink,Tampil cantik dengan atasan ini! Padankan dengan celana palazzo serta heels dan clutch!,"[clothing, plain]","[pakaian, atasan, blus]",pink,berrybenka,,,uploads/roselma-glitter-top-pink_pink_1.jpg,uploads/roselma-glitter-top-pink_pink_1.jpg,uploads/roselma-glitter-top-pink_pink_2.jpg,uploads/roselma-glitter-top-pink_pink_3.jpg,uploads/roselma-glitter-top-pink_pink_4.jpg,uploads/roselma-glitter-top-pink_pink_5.jpg,,,,S,BEROCLPIS0-IA,199000,0,700,10,M,BEROCLPIM0-2R,199000,0,700,10,L,HIERCLBLL0-GK,199000,0,700,10,XL,HINACLBRXL-CG,199000,0,700,10,,https://invol.co/cl5idih,,Tampil cantik dengan atasan ini! Padankan dengan celana palazzo serta heels dan clutch!
Hristina Dress Pink,Tampil gaya dengan blouse yang memiliki aksen drapery. Padankan dengan celana palazzo serta heels.,"[clothing, tied]","[pakaian, atasan, blus]",pink,berrybenka,,,uploads/hristina-dress-pink_pink_1.jpg,uploads/hristina-dress-pink_pink_1.jpg,uploads/hristina-dress-pink_pink_2.jpg,uploads/hristina-dress-pink_pink_3.jpg,uploads/hristina-dress-pink_pink_4.jpg,uploads/hristina-dress-pink_pink_5.jpg,,,,S,BEROCLPIS0-IA,199000,0,700,10,M,BEHRCLPIM0-H6,199000,0,700,10,L,HIERCLBLL0-GK,199000,0,700,10,XL,HINACLBRXL-CG,199000,0,700,10,,https://invol.co/cl5iexm,,Tampil gaya dengan blouse yang memiliki aksen drapery. Padankan dengan celana palazzo serta heels.
Jacie Peplum Blouse Black,Atasan lengan 3/4 untuk tampilan feminin kamu! Memiliki model simpel dengan aksen peplum. Padankan dengan celana panjang slim fit dan heels warna netral favoritmu!,"[clothing, asymmetric]","[pakaian, atasan, blus]",black,berrybenka,TRUE,,uploads/jacie-peplum-blouse-black_black_1.jpg,uploads/jacie-peplum-blouse-black_black_1.jpg,uploads/jacie-peplum-blouse-black_black_2.jpg,uploads/jacie-peplum-blouse-black_black_3.jpg,uploads/jacie-peplum-blouse-black_black_4.jpg,uploads/jacie-peplum-blouse-black_black_5.jpg,,,,ONE SIZE,BEJACLBLON-QB,199000,0,700,10,,,,,,,,,,,,,,,,,,,,https://invol.co/cl5if3x,,Atasan lengan 3/4 untuk tampilan feminin kamu! Memiliki model simpel dengan aksen peplum. Padankan dengan celana panjang slim fit dan heels warna netral favoritmu!
Gildore Biege Cut Out Dress,Dress tanpa lengan dengan model yang simpel memiliki detil kerah v neck. padu padankan dengan heels dan clutch bag untuk melengkapi penampilan kamu.,"[clothing, layering]","[pakaian, dress, mini dress]",cream,berrybenka,,,uploads/gildore-biege-cut-out-dress_beige_1.jpg,uploads/gildore-biege-cut-out-dress_beige_1.jpg,uploads/gildore-biege-cut-out-dress_beige_2.jpg,uploads/gildore-biege-cut-out-dress_beige_3.jpg,uploads/gildore-biege-cut-out-dress_beige_4.jpg,uploads/gildore-biege-cut-out-dress_beige_5.jpg,,,,M,BEGICLWHM0-O5,199000,0,700,10,XL,BEGICLWHXL-9K,199000,0,700,10,,,,,,,,,,,,,,https://invol.co/cl5iffd,,Dress tanpa lengan dengan model yang simpel memiliki detil kerah v neck. padu padankan dengan heels dan clutch bag untuk melengkapi penampilan kamu.
Omiara Flare Top Yellow,Atasan dengan model menarik yang cocok kamu padankan dengan hijab dan mules favoritmu.,[clothing],"[pakaian, atasan]",yellow,hijabenka,,,uploads/omiara-flare-top-yellow_yellow_1.jpg,uploads/omiara-flare-top-yellow_yellow_1.jpg,uploads/omiara-flare-top-yellow_yellow_2.jpg,uploads/omiara-flare-top-yellow_yellow_3.jpg,uploads/omiara-flare-top-yellow_yellow_4.jpg,uploads/omiara-flare-top-yellow_yellow_5.jpg,,,,S,HIOMCLYES0-LY,179000,0,700,10,M,HIOMCLYEM0-O0,179000,0,700,10,L,HIOMCLYEL0-SV,179000,0,700,10,XL,HIOMCLYEXL-Q8,179000,0,700,10,https://invol.co/cl5ifnh,,,Atasan dengan model menarik yang cocok kamu padankan dengan hijab dan mules favoritmu.
Wanola Floral Loose Blouse White,Tampil feminin dengan blouse yang memiliki motif menarik. Padankan dengan celana slim fit serta hijab dan mules warna,"[clothing, baju kerja wanita]","[pakaian, atasan]",white,hijabenka,,,uploads/wanola-floral-loose-blouse-white_white_1.jpg,uploads/wanola-floral-loose-blouse-white_white_1.jpg,uploads/wanola-floral-loose-blouse-white_white_2.jpg,uploads/wanola-floral-loose-blouse-white_white_3.jpg,uploads/wanola-floral-loose-blouse-white_white_4.jpg,uploads/wanola-floral-loose-blouse-white_white_5.jpg,,,,ONE SIZE,HIWACLWHON-G6,199000,0,700,10,,,,,,,,,,,,,,,,,,,https://invol.co/cl5ifrd,,,Tampil feminin dengan blouse yang memiliki motif menarik. Padankan dengan celana slim fit serta hijab dan mules warna
Belisa Flare Tunik Grey,Tampil gaya dengan atasan yang cocok kamu padankan dengan celana palazzo serta hijab dan sepatu warna senada.,"[clothing, dress]","[pakaian, atasan]",grey,hijabenka,,,uploads/belisa-flare-tunik-grey_grey_1.jpg,uploads/belisa-flare-tunik-grey_grey_1.jpg,uploads/belisa-flare-tunik-grey_grey_2.jpg,uploads/belisa-flare-tunik-grey_grey_3.jpg,uploads/belisa-flare-tunik-grey_grey_4.jpg,uploads/belisa-flare-tunik-grey_grey_5.jpg,,,,S,HIBECLGRM0-T2,199000,0,700,10,M,HIBECLGRM0-T2,199000,0,700,10,L,HIBECLGRL0-YP,199000,0,700,10,XL,HIBECLGRXL-CM,199000,0,700,10,https://invol.co/cl5ii3b,,,Tampil gaya dengan atasan yang cocok kamu padankan dengan celana palazzo serta hijab dan sepatu warna senada.
Sabella Top Grey,Tampil gaya dengan atasan lengan panjang yang cocok kamu padankan dengan celana panjng serta hijab dan sepatu warna netral.,"[clothing, baju kerja wanita]","[pakaian, atasan]",grey,hijabenka,,,uploads/sabella-top-grey_grey_1.jpg,uploads/sabella-top-grey_grey_1.jpg,uploads/sabella-top-grey_grey_2.jpg,uploads/sabella-top-grey_grey_3.jpg,uploads/sabella-top-grey_grey_4.jpg,uploads/sabella-top-grey_grey_5.jpg,,,,S,HISACLGRS0-3G,199000,0,700,10,M,HISACLGRM0-XA,199000,0,700,10,L,HISACLGRM0-XA,199000,0,700,10,,,,,,,https://invol.co/cl5ii82,,,Tampil gaya dengan atasan lengan panjang yang cocok kamu padankan dengan celana panjng serta hijab dan sepatu warna netral.
Salvia Tunik Brown,Tampil trendi dengan atasan lengan panjang yang cocok kamu padankan dengan celana serta hijab warna senada favoritmu!,"[clothing, baju kerja wanita]","[pakaian, atasan]",brown,hijabenka,,,uploads/salvia-tunik-brown_brown_1.jpg,uploads/salvia-tunik-brown_brown_1.jpg,uploads/salvia-tunik-brown_brown_2.jpg,uploads/salvia-tunik-brown_brown_3.jpg,uploads/salvia-tunik-brown_brown_4.jpg,uploads/salvia-tunik-brown_brown_5.jpg,,,,S,HISACLGRS0-3G,199000,0,700,10,M,HISACLBRM0-EU,199000,0,700,10,L,HISACLBRL0-09,199000,0,700,10,,,,,,,https://invol.co/cl5iid9,,,Tampil trendi dengan atasan lengan panjang yang cocok kamu padankan dengan celana serta hijab warna senada favoritmu!
Kiyoko Tunik Peach,Tampil gaya dengan atasan yang cocok kamu padankan dengan celana palazzo serta hijab dan heels warna senada.,[clothing],"[pakaian, atasan]",pink,hijabenka,,,uploads/kiyoko-tunik-peach_pink_1.jpg,uploads/kiyoko-tunik-peach_pink_1.jpg,uploads/kiyoko-tunik-peach_pink_2.jpg,uploads/kiyoko-tunik-peach_pink_3.jpg,uploads/kiyoko-tunik-peach_pink_4.jpg,uploads/kiyoko-tunik-peach_pink_5.jpg,,,,ONE SIZE,HIKICLPION-WF,199000,0,700,10,,,,,,,,,,,,,,,,,,,https://invol.co/cl5iiyg,,,Tampil gaya dengan atasan yang cocok kamu padankan dengan celana palazzo serta hijab dan heels warna senada.
Mahveen Jules Tunic Grey,Tampil gaya dengan atasan lengan panjang yang cocok dikenakan sehari-hari dengan hijab warna favoritmu!,[clothing],"[pakaian, atasan]",grey,hijabenka,TRUE,,uploads/mahveen-jules-tunic-grey_grey_1.jpg,uploads/mahveen-jules-tunic-grey_grey_1.jpg,uploads/mahveen-jules-tunic-grey_grey_2.jpg,uploads/mahveen-jules-tunic-grey_grey_3.jpg,uploads/mahveen-jules-tunic-grey_grey_4.jpg,uploads/mahveen-jules-tunic-grey_grey_5.jpg,,,,ONE SIZE,HIMACLGRON-0K,199000,0,700,10,,,,,,,,,,,,,,,,,,,https://invol.co/cl5ij1h,,,Tampil gaya dengan atasan lengan panjang yang cocok dikenakan sehari-hari dengan hijab warna favoritmu!
Mahveen Jules Tunic Cream,Tampil gaya dengan atasan lengan panjang yang cocok dikenakan sehari-hari dengan hijab warna favoritmu!,[clothing],"[pakaian, atasan]",cream,hijabenka,,,uploads/mahveen-jules-tunic-cream_cream_1.jpg,uploads/mahveen-jules-tunic-cream_cream_1.jpg,uploads/mahveen-jules-tunic-cream_cream_2.jpg,uploads/mahveen-jules-tunic-cream_cream_3.jpg,uploads/mahveen-jules-tunic-cream_cream_4.jpg,,,,,ONE SIZE,HIMACLCRON-8P,199000,0,700,10,,,,,,,,,,,,,,,,,,,https://invol.co/cl5ij8l,,,Tampil gaya dengan atasan lengan panjang yang cocok dikenakan sehari-hari dengan hijab warna favoritmu!
Lacy Scrunch Up Detail Top Light Brown,Tampil gaya dengan mengenakan atasan lengan panjang ini! Memiliki model simpel dengan detail tali kerut di bagian lengan. Padankan dengan celana kulot dan hijab warna netral serta loafers favoritmu!,[clothing],"[pakaian, atasan]",brown,hijabenka,,,uploads/lacy-scrunch-up-detail-top-light-brown_brown_1.jpg,uploads/lacy-scrunch-up-detail-top-light-brown_brown_1.jpg,uploads/lacy-scrunch-up-detail-top-light-brown_brown_2.jpg,uploads/lacy-scrunch-up-detail-top-light-brown_brown_3.jpg,,,,,,S,HILACLBRS0-2E,199000,0,700,10,M,HILACLBRM0-M4,199000,0,700,10,L,HILACLBRL0-6Y,199000,0,700,10,,,,,,,https://invol.co/cl5ik7y,,,Tampil gaya dengan mengenakan atasan lengan panjang ini! Memiliki model simpel dengan detail tali kerut di bagian lengan. Padankan dengan celana kulot dan hijab warna netral serta loafers favoritmu!
Vashia Long Shirt Brown,Atasan dengan model menarik yang cocok kamu padankan dengan hijab warna senada.,[clothing],"[pakaian, atasan, kemeja]",brown,hijabenka,,,uploads/vashia-long-shirt-brown_brown_1.jpg,uploads/vashia-long-shirt-brown_brown_1.jpg,uploads/vashia-long-shirt-brown_brown_2.jpg,uploads/vashia-long-shirt-brown_brown_3.jpg,uploads/vashia-long-shirt-brown_brown_4.jpg,uploads/vashia-long-shirt-brown_brown_5.jpg,,,,ONE SIZE,HIVACLBRON-VW,299000,0,700,10,,,,,,,,,,,,,,,,,,,https://invol.co/cl5ikfu,,,Atasan dengan model menarik yang cocok kamu padankan dengan hijab warna senada.
Vlesa Blouse Brown,Atasan dengan model menarik yang cocok kamu padankan dengan hijab warna senada.,[clothing],"[pakaian, atasan]",brown,hijabenka,,,uploads/vlesa-blouse-brown_brown_1.jpg,uploads/vlesa-blouse-brown_brown_1.jpg,uploads/vlesa-blouse-brown_brown_2.jpg,uploads/vlesa-blouse-brown_brown_3.jpg,uploads/vlesa-blouse-brown_brown_4.jpg,uploads/vlesa-blouse-brown_brown_5.jpg,,,,ONE SIZE,HIVLCLBRON-DV,249000,0,700,10,,,,,,,,,,,,,,,,,,,https://invol.co/cl5ikls,,,Atasan dengan model menarik yang cocok kamu padankan dengan hijab warna senada.
Rhode Top Blue,Atasan dengan model menarik yang cocok kamu padankan dengan hijab favoritmu!,[clothing],"[pakaian, atasan]",blue,hijabenka,,,uploads/rhode-top-blue_blue_1.jpg,uploads/rhode-top-blue_blue_1.jpg,uploads/rhode-top-blue_blue_2.jpg,uploads/rhode-top-blue_blue_3.jpg,uploads/rhode-top-blue_blue_4.jpg,uploads/rhode-top-blue_blue_5.jpg,,,,S,HIRHCLBLS0-BE,189000,0,700,10,M,HIRHCLBLM0-9H,189000,0,700,10,L,HIRHCLBLL0-VA,189000,0,700,10,XL,HIRHCLBLXL-YS,189000,0,700,10,https://invol.co/cl5ikrn,,,Atasan dengan model menarik yang cocok kamu padankan dengan hijab favoritmu!
Rahrah Ruffled Top Brown,Atasan dengan model menarik yang cocok kamu padankan dengan,[clothing],"[pakaian, atasan]",brown,hijabenka,,,uploads/rahrah-ruffled-top-brown_brown_1.jpg,uploads/rahrah-ruffled-top-brown_brown_1.jpg,uploads/rahrah-ruffled-top-brown_brown_2.jpg,uploads/rahrah-ruffled-top-brown_brown_3.jpg,uploads/rahrah-ruffled-top-brown_brown_4.jpg,uploads/rahrah-ruffled-top-brown_brown_5.jpg,uploads/rahrah-ruffled-top-brown_brown_6.jpg,,,S,HIRACLBRS0-HG,209000,0,700,10,M,HIRACLBRM0-JL,209000,0,700,10,L,HIRACLBRL0-JE,209000,0,700,10,XL,HIRACLBRXL-3V,209000,0,700,10,https://invol.co/cl5ikvu,,,Atasan dengan model menarik yang cocok kamu padankan dengan
Keana Top Beige,Atasan dengan model menarik yang cocok kamu padankan dengan hijab favoritmu!,[clothing],"[pakaian, atasan]",grey,hijabenka,,,uploads/keana-top-beige_cream_1.jpg,uploads/keana-top-beige_cream_1.jpg,uploads/keana-top-beige_cream_2.jpg,uploads/keana-top-beige_cream_3.jpg,uploads/keana-top-beige_cream_4.jpg,uploads/keana-top-beige_cream_5.jpg,,,,M,HIKECLCRM0-OU,269000,0,700,10,L,HIKECLCRL0-2C,269000,0,700,10,,,,,,,,,,,,,https://invol.co/cl5ir9u,,,Atasan dengan model menarik yang cocok kamu padankan dengan hijab favoritmu!
Sephia Virani Puffsleeve Blouse Dusty Pink,Atasan dengan model menarik yang cocok kamu padankan dengan hijab favoritmu!,[clothing],"[pakaian, atasan]",pink,hijabenka,,,uploads/sephia-virani-puffsleeve-blouse-dusty-pink_pink_1.jpg,uploads/sephia-virani-puffsleeve-blouse-dusty-pink_pink_1.jpg,uploads/sephia-virani-puffsleeve-blouse-dusty-pink_pink_2.jpg,uploads/sephia-virani-puffsleeve-blouse-dusty-pink_pink_3.jpg,uploads/sephia-virani-puffsleeve-blouse-dusty-pink_pink_4.jpg,uploads/sephia-virani-puffsleeve-blouse-dusty-pink_pink_5.jpg,,,,ONE SIZE,HISECLPION-CE,139000,0,700,10,,,,,,,,,,,,,,,,,,,https://invol.co/cl5irdv,,,Atasan dengan model menarik yang cocok kamu padankan dengan hijab favoritmu!
Sephia Ife Peplum Blouse Mocca,Atasan dengan model menarik yang cocok kamu padankan dengan hijab favoritmu!,[clothing],"[pakaian, atasan]",mocca,hijabenka,,,uploads/sephia-ife-peplum-blouse-mocca_brown_1.jpg,uploads/sephia-ife-peplum-blouse-mocca_brown_1.jpg,uploads/sephia-ife-peplum-blouse-mocca_brown_2.jpg,uploads/sephia-ife-peplum-blouse-mocca_brown_3.jpg,uploads/sephia-ife-peplum-blouse-mocca_brown_4.jpg,uploads/sephia-ife-peplum-blouse-mocca_brown_5.jpg,,,,ONE SIZE,HISECLPION-QR,139000,0,700,10,,,,,,,,,,,,,,,,,,,https://invol.co/cl5irhz,,,Atasan dengan model menarik yang cocok kamu padankan dengan hijab favoritmu!
Sephia Melia Pleated Blouse Grey,Atasan dengan model menarik yang cocok kamu padankan dengan celana slim fit dan mules.,[clothing],"[pakaian, atasan]",grey,hijabenka,,,uploads/sephia-melia-pleated-blouse-grey_grey_1.jpg,uploads/sephia-melia-pleated-blouse-grey_grey_1.jpg,uploads/sephia-melia-pleated-blouse-grey_grey_2.jpg,uploads/sephia-melia-pleated-blouse-grey_grey_3.jpg,uploads/sephia-melia-pleated-blouse-grey_grey_4.jpg,uploads/sephia-melia-pleated-blouse-grey_grey_5.jpg,,,,ONE SIZE,HISECLGRON-SP,139000,0,700,10,,,,,,,,,,,,,,,,,,,https://invol.co/cl5irlj,,,Atasan dengan model menarik yang cocok kamu padankan dengan celana slim fit dan mules.
Sephia Elora Flare Tunic Brown,Tampil gaya dengan tunik yang cocok kamu padankan dengan heels serta hijab warna netral.,[clothing],"[pakaian, atasan]",brown,hijabenka,,,uploads/sephia-elora-flare-tunic-brown_brown_1.jpg,uploads/sephia-elora-flare-tunic-brown_brown_1.jpg,uploads/sephia-elora-flare-tunic-brown_brown_2.jpg,uploads/sephia-elora-flare-tunic-brown_brown_3.jpg,uploads/sephia-elora-flare-tunic-brown_brown_4.jpg,uploads/sephia-elora-flare-tunic-brown_brown_5.jpg,,,,ONE SIZE,HISECLBRON-NY,139000,0,700,10,,,,,,,,,,,,,,,,,,,https://invol.co/cl5irou,,,Tampil gaya dengan tunik yang cocok kamu padankan dengan heels serta hijab warna netral.
Sephia Fiona Assymetric Blouse Grey,Atasan dengan model menarik yang cocok kamu padankan dengan hijab favoritmu!,[clothing],"[pakaian, atasan]",grey,hijabenka,TRUE,,uploads/sephia-fiona-assymetric-blouse-grey_grey_1.jpg,uploads/sephia-fiona-assymetric-blouse-grey_grey_1.jpg,uploads/sephia-fiona-assymetric-blouse-grey_grey_2.jpg,uploads/sephia-fiona-assymetric-blouse-grey_grey_3.jpg,uploads/sephia-fiona-assymetric-blouse-grey_grey_4.jpg,uploads/sephia-fiona-assymetric-blouse-grey_grey_5.jpg,,,,ONE SIZE,HISECLGRON-FQ,139000,0,700,10,,,,,,,,,,,,,,,,,,,https://invol.co/cl5irru,,,Atasan dengan model menarik yang cocok kamu padankan dengan hijab favoritmu!
Sephia Felix Slit Shirt Brown,Atasan dengan model menarik yang cocok kamu padankan dengan hijab favoritmu!,[clothing],"[pakaian, atasan, kemeja]",brown,hijabenka,,,uploads/sephia-felix-slit-shirt-brown_brown_1.jpg,uploads/sephia-felix-slit-shirt-brown_brown_1.jpg,uploads/sephia-felix-slit-shirt-brown_brown_2.jpg,uploads/sephia-felix-slit-shirt-brown_brown_3.jpg,uploads/sephia-felix-slit-shirt-brown_brown_4.jpg,uploads/sephia-felix-slit-shirt-brown_brown_5.jpg,,,,ONE SIZE,HISECLBRON-ZQ,139000,0,700,10,,,,,,,,,,,,,,,,,,,https://invol.co/cl5is13,,,Atasan dengan model menarik yang cocok kamu padankan dengan hijab favoritmu!
Sephia Fera Long Shirt Olive,Atasan dengan model menarik yang cocok kamu padankan dengan hijab favoritmu!,[clothing],"[pakaian, atasan, kemeja]",green,hijabenka,TRUE,,uploads/sephia-fera-long-shirt-olive_green_1.jpg,uploads/sephia-fera-long-shirt-olive_green_1.jpg,uploads/sephia-fera-long-shirt-olive_green_2.jpg,uploads/sephia-fera-long-shirt-olive_green_3.jpg,uploads/sephia-fera-long-shirt-olive_green_4.jpg,uploads/sephia-fera-long-shirt-olive_green_5.jpg,,,,ONE SIZE,HISECLGRON-4E,139000,0,700,10,,,,,,,,,,,,,,,,,,,https://invol.co/cl5is5o,,,Atasan dengan model menarik yang cocok kamu padankan dengan hijab favoritmu!
Sephia Finna Drawstring Tunic Cream,Atasan dengan model menarik yang cocok kamu padankan dengan hijab favoritmu!,[clothing],"[pakaian, atasan]",cream,hijabenka,,,uploads/sephia-finna-drawstring-tunic-cream_cream_1.jpg,uploads/sephia-finna-drawstring-tunic-cream_cream_1.jpg,uploads/sephia-finna-drawstring-tunic-cream_cream_2.jpg,uploads/sephia-finna-drawstring-tunic-cream_cream_3.jpg,uploads/sephia-finna-drawstring-tunic-cream_cream_4.jpg,uploads/sephia-finna-drawstring-tunic-cream_cream_5.jpg,,,,ONE SIZE,HISECLCRON-G0,139000,0,700,10,,,,,,,,,,,,,,,,,,,https://invol.co/cl5is8y,,,Atasan dengan model menarik yang cocok kamu padankan dengan hijab favoritmu!
Sephia Fitta Basic Shirt Green,Atasan dengan model menarik yang cocok kamu padankan dengan hijab favoritmu!,[clothing],"[pakaian, atasan, kemeja]",green,hijabenka,,,uploads/sephia-fitta-basic-shirt-green_green_1.jpg,uploads/sephia-fitta-basic-shirt-green_green_1.jpg,uploads/sephia-fitta-basic-shirt-green_green_2.jpg,uploads/sephia-fitta-basic-shirt-green_green_3.jpg,uploads/sephia-fitta-basic-shirt-green_green_4.jpg,uploads/sephia-fitta-basic-shirt-green_green_5.jpg,,,,ONE SIZE,HISECLGRON-WH,139000,0,700,10,,,,,,,,,,,,,,,,,,,https://invol.co/cl5isej,,,Atasan dengan model menarik yang cocok kamu padankan dengan hijab favoritmu!
Sephia Filia Flare Blouse Brown,Atasan dengan model menarik yang cocok kamu padankan dengan hijab favoritmu!,[clothing],"[pakaian, atasan]",brown,hijabenka,,,uploads/sephia-filia-flare-blouse-brown_brown_1.jpg,uploads/sephia-filia-flare-blouse-brown_brown_1.jpg,uploads/sephia-filia-flare-blouse-brown_brown_2.jpg,uploads/sephia-filia-flare-blouse-brown_brown_3.jpg,uploads/sephia-filia-flare-blouse-brown_brown_4.jpg,uploads/sephia-filia-flare-blouse-brown_brown_5.jpg,,,,ONE SIZE,HISECLBRON-AR,139000,0,700,10,,,,,,,,,,,,,,,,,,,https://invol.co/cl5isiq,,,Atasan dengan model menarik yang cocok kamu padankan dengan hijab favoritmu!
Namirah Simply Pants Brown,Celana yang simple cocok dipadankan dengan berbagai macam atasan serta sepatu favoritmu!,[clothing],"[pakaian, bawahan, celana panjang]",brown,hijabenka,,,uploads/namirah-simply-pants-brown_brown_1.jpg,uploads/namirah-simply-pants-brown_brown_1.jpg,uploads/namirah-simply-pants-brown_brown_2.jpg,uploads/namirah-simply-pants-brown_brown_3.jpg,uploads/namirah-simply-pants-brown_brown_4.jpg,uploads/namirah-simply-pants-brown_brown_5.jpg,,,,S,HINACLBRS0-X4,169000,0,700,10,M,HINACLBRM0-A0,169000,0,700,10,L,HINACLBRL0-MA,169000,0,700,10,,,,,,,https://invol.co/cl5itxa,,,Celana yang simple cocok dipadankan dengan berbagai macam atasan serta sepatu favoritmu!
Pennie Front Drawstring Pants,"Tampil gaya dengan bawahan ini! Cocok untuk tampilan casual, padankan dengan atasan simple serta hijab dan sepatu favoritmu!","[clothing, skinny pants]","[pakaian, bawahan, celana panjang]",brown,hijabenka,,,uploads/pennie-front-drawstring-pants_brown_1.jpg,uploads/pennie-front-drawstring-pants_brown_1.jpg,uploads/pennie-front-drawstring-pants_brown_2.jpg,uploads/pennie-front-drawstring-pants_brown_3.jpg,uploads/pennie-front-drawstring-pants_brown_4.jpg,uploads/pennie-front-drawstring-pants_brown_5.jpg,,,,S,HIPECLBRS0-L2,199000,0,700,10,M,HIPECLBRM0-HG,199000,0,700,10,,,,,,,,,,,,,https://invol.co/cl5iw0v,,,"Tampil gaya dengan bawahan ini! Cocok untuk tampilan casual, padankan dengan atasan simple serta hijab dan sepatu favoritmu!"
Sephia Bekka Comfort Pants Green,Celana yang simple cocok dipadankan dengan berbagai macam atasan serta sepatu favoritmu!,[clothing],"[pakaian, bawahan, celana panjang]",green,hijabenka,,,uploads/sephia-bekka-comfort-pants-green_green_1.jpg,uploads/sephia-bekka-comfort-pants-green_green_1.jpg,uploads/sephia-bekka-comfort-pants-green_green_2.jpg,uploads/sephia-bekka-comfort-pants-green_green_3.jpg,uploads/sephia-bekka-comfort-pants-green_green_4.jpg,uploads/sephia-bekka-comfort-pants-green_green_5.jpg,,,,ONE SIZE,HISECLGRON-U8,279000,0,700,10,,,,,,,,,,,,,,,,,,,https://invol.co/cl5iw52,,,Celana yang simple cocok dipadankan dengan berbagai macam atasan serta sepatu favoritmu!
Shire Pants Lilac,Celana yang simple cocok dipadankan dengan berbagai macam atasan serta sepatu favoritmu!,[clothing],"[pakaian, bawahan, celana panjang]",purple,hijabenka,,,uploads/shire-pants-lilac_purple_1.jpg,uploads/shire-pants-lilac_purple_1.jpg,uploads/shire-pants-lilac_purple_2.jpg,uploads/shire-pants-lilac_purple_3.jpg,uploads/shire-pants-lilac_purple_4.jpg,uploads/shire-pants-lilac_purple_5.jpg,,,,S,HISHCLPUS0-8O,209000,0,700,10,M,HISHCLPUM0-Q6,209000,0,700,10,L,HISHCLPUL0-5J,209000,0,700,10,XL,HISHCLPUXL-P5,209000,0,700,10,https://invol.co/cl5iw9j,,,Celana yang simple cocok dipadankan dengan berbagai macam atasan serta sepatu favoritmu!
Sherry Pleated Culotte Cream,Celana yang simple cocok dipadankan dengan berbagai macam atasan serta sepatu favoritmu!,[clothing],"[pakaian, bawahan, celana panjang]",cream,hijabenka,,,uploads/sherry-pleated-culotte-cream_cream_1.jpg,uploads/sherry-pleated-culotte-cream_cream_1.jpg,uploads/sherry-pleated-culotte-cream_cream_2.jpg,uploads/sherry-pleated-culotte-cream_cream_3.jpg,uploads/sherry-pleated-culotte-cream_cream_4.jpg,uploads/sherry-pleated-culotte-cream_cream_5.jpg,,,,M,HISHCLCRM0-L3,209000,0,700,10,L,HISHCLCRL0-7Y,209000,0,700,10,,,,,,,,,,,,,https://invol.co/cl5iwcr,,,Celana yang simple cocok dipadankan dengan berbagai macam atasan serta sepatu favoritmu!
Keira Pants Beige,Celana yang simple cocok dipadankan dengan berbagai macam atasan serta sepatu favoritmu!,[clothing],"[pakaian, bawahan, celana panjang]",cream,hijabenka,,,uploads/keira-pants-beige_cream_1.jpg,uploads/keira-pants-beige_cream_1.jpg,uploads/keira-pants-beige_cream_2.jpg,uploads/keira-pants-beige_cream_3.jpg,uploads/keira-pants-beige_cream_4.jpg,uploads/keira-pants-beige_cream_5.jpg,,,,M,HIKECLCRM0-L3,199000,0,700,10,L,HIKECLCRL0-XR,199000,0,700,10,,,,,,,,,,,,,https://invol.co/cl5iwg9,,,Celana yang simple cocok dipadankan dengan berbagai macam atasan serta sepatu favoritmu!
Vuvu Midi Dress Brown,Miliki dress yang cocok kamu padankan dengan berbagai macam Hijab favoritmu.,[clothing],"[pakaian, dress, jumpsuit]",brown,hijabenka,,,uploads/vuvu-midi-dress-brown_brown_1.jpg,uploads/vuvu-midi-dress-brown_brown_1.jpg,uploads/vuvu-midi-dress-brown_brown_2.jpg,uploads/vuvu-midi-dress-brown_brown_3.jpg,uploads/vuvu-midi-dress-brown_brown_4.jpg,uploads/vuvu-midi-dress-brown_brown_5.jpg,,,,S,HIVUCLBRS0-QU,299000,0,700,10,M,HIVUCLBRM0-PE,299000,0,700,10,L,HIVUCLBRL0-RI,299000,0,700,10,XL,HIVUCLBRXL-3W,299000,0,700,10,https://invol.co/cl5iwnm,,,Miliki dress yang cocok kamu padankan dengan berbagai macam Hijab favoritmu.
Veona Outer Brown,Luaran dengan model menarik yang cocok dipadankan dengan berbagai macam Hijab favoritmu serta celana palazzo.,[clothing],"[pakaian, outwear]",brown,hijabenka,,,uploads/veona-outer-brown_brown_1.jpg,uploads/veona-outer-brown_brown_1.jpg,uploads/veona-outer-brown_brown_2.jpg,uploads/veona-outer-brown_brown_3.jpg,uploads/veona-outer-brown_brown_4.jpg,uploads/veona-outer-brown_brown_5.jpg,,,,ONE SIZE,HIVECLBRON-5Y,279000,0,700,10,,,,,,,,,,,,,,,,,,,https://invol.co/cl5iwrs,,,Luaran dengan model menarik yang cocok dipadankan dengan berbagai macam Hijab favoritmu serta celana palazzo.
